{
  "v": "1",
  "id": "01J9ZK3V7QABCDEFGHJKMNPQRS",
  "cause_id": "01J9ZK2M1PABCDEFGHJKMNPQRS",
  "session": "sess-8f3a",
  "node": "eco",
  "port": "text_out",
  "seq": 7,
  "idem": "sess-8f3a:eco:text_out:7",
  "schema": "std/text@1",
  "kind": "data",
  "payload": { "text": "hola", "final": true }
}
